id,item_id,fling_effect_id,effect,short_effect,flavor_text
450,450,,训练师在战斗中使用：尝试捕捉野生精灵。如果在训练师对战中使用，则不会产生效果并会消耗。己方精灵等级相对野生精灵越高，捕获率越高。,己方精灵等级越高，捕获率越高。由红色球果制成。,有点与众不同的球。 要捕捉的精灵比自己精灵的 等级越低，就会越容易捕捉。
451,451,,训练师在对战中使用：尝试捕捉野生精灵。如果在训练师对战中使用，则不会产生效果并会消耗。若目标属于皮皮、尼多朗、尼多兰、胖丁、向尾喵及其进化家族，捕获率变为 4 倍。,对使用月之石进化的精灵家族捕获效果提高 4 倍。由黄色球果制成。,有点与众不同的球。 能很容易地捕捉 使用月之石进化的精灵。
452,452,,训练师在战斗中使用：尝试捕捉野生精灵。如果在训练师对战中使用，则不会产生效果并会消耗。根据野生精灵的重量，对捕获率给予固定奖励或惩罚。,根据目标的重量等级，对捕获率有固定的奖励或惩罚。由黑色球果制成。,有点与众不同的球。 能很容易地捕捉 身体沉重的精灵。
453,453,,训练师在战斗中使用：尝试捕捉野生精灵。如果在训练师对战中使用，则不会产生效果并会消耗。若野生精灵的基础速度为 100 或以上，捕获率变为 4 倍。,对基础速度为 100 或更高的精灵捕获率为 4 倍。由白色球果制成。,有点与众不同的球。 能很容易地捕捉 逃跑速度很快的精灵。
454,454,,训练师在战斗中使用：尝试捕捉野生精灵。如果在训练师对战中使用，则不会产生效果并会消耗。被捕获的精灵亲密度从 200 开始。,捕获的精灵初始亲密度为 200。由绿色球果制成。,有点与众不同的球。 捉到的野生精灵会立刻 变得和训练家亲密起来。
455,455,,训练师在战斗中使用：尝试捕捉野生精灵。如果在训练师对战中使用，则不会产生效果并会消耗。若己方精灵与野生精灵为同种异性，捕获率变为 8 倍。,对己方精灵异性的同种目标捕获率为 8 倍。由粉色球果制成。,有点与众不同的球。 能很容易地捕捉 和自己精灵性别不同的精灵。
457,457,,训练师在战斗中使用：尝试捕捉野生精灵。野生精灵的捕获率是正常的1.5倍。,尝试在国家公园的捉虫比赛中捕捉精灵。 （第二代：公园球）,曽在城都地区的捕虫大赛上使用的 特殊的球。
580,580,,由丑丑鱼持有：通信交换时将持有者进化为美纳斯。,丑丑鱼通信交换时持有：持有者进化为美纳斯。,能让某些特定精灵 进化的神奇鳞片。 散发着虹色光辉。
581,581,,未完全进化的精灵持有：持有者的防御力和特防力为 1.5 倍。,持有：持有者拥有1.5倍的防御和特防，只要它没有完全进化。,进化的神奇石块。 携带后，还能进化的精灵的 防御和特防就会提高。
582,582,,持有：持有者有 0.5 倍的重量。,持有：持有者有0.5×重量。,非常轻的石头。 携带后，精灵的体重会变轻。
583,583,,持有：当持有者被接触技能击中时，攻击的精灵会受到其最大生命值 1/6 的伤害。,持有：当持有者被接触技能击中时，攻击的精灵会受到其最大生命值 1/6 的伤害。,让精灵携带后， 在受到打击技能攻击时， 能给予对手伤害。
584,584,,持有：持有者免疫地面属性技能、尖刺、有毒尖刺和竞技场陷阱。此效果在“重力”或“扎根”期间不适用。当持有者因技能而受到伤害时，该物品就会被消耗。,持有：免疫地面属性技能、尖刺和有毒尖刺。当持有者因技能而受到伤害时消耗。,让精灵携带后， 精灵会浮在空中。 受到攻击就会破裂。
585,585,,持有：当持有者直接因技能而受到伤害并且没有晕倒时，它会切换到队伍中的另一只随机的、未晕倒的精灵。如果其他效果阻止持有者切换出去，则该效果不会激活。,持有：当持有者因技能而受到伤害时，对手会随机切换到另一只队伍精灵。使用后消耗掉。,有着神奇力量的卡片。 携带后，能让使用了 技能的对手退场。
586,586,,持有：当使用者的其中一种属性使其免受伤害时，该属性在伤害计算中将被忽略。,持有：否定持有者的属性豁免权。技能免疫不会被移除。,原本因精灵的属性相克关系 而无效的技能现在会变得 能够击中自己。
587,587,,持有：持有者使用的在多回合内困住并伤害目标的技能（例如束缚、火焰旋涡）造成的每回合伤害是通常的两倍。,持有：使多回合诱捕技能的每回合伤害加倍。,能增强绑紧技能的束带。 携带后，绑紧技能的威力会变强。
588,588,,持有：当持有者因技能受到水属性伤害时，其特攻上升一级，并且该物品被消耗。,持有：受到水属性伤害时，持有者的特攻提升一级。,一次性使用的球根。 携带它的精灵如果受到水属性 技能的攻击，特攻就会提高。
589,589,,持有：当持有者受到电属性技能伤害时，攻击力提升一级，并消耗该物品。,持有：受到电属性伤害时，持有者的攻击力提升一级。,一次性使用的充电电池。 携带它的精灵如果受到电属性 技能的攻击，攻击就会提高。
590,590,,持有：当持有者直接因技能而受到伤害并且没有晕倒时，它会切换到队伍中由训练家选择的另一只未晕倒的精灵。如果其他效果阻止持有者切换出去，则该效果不会激活。,持有：当持有者因技能而受到伤害时，它会切换为训练师选择的队伍精灵。,携带它的精灵如果受到技能攻击， 就能逃脱战斗，并和同行的 其他精灵进行替换。
612,612,,可在商店出售换取金钱。,售价 100 神奇币。,仅仅只是漂亮， 没有任何效果， 极其普通的羽毛。
617,617,,只能在连入之森中使用，用来捕捉梦世界中遇到的精灵。用于对战：成功捕捉野生精灵。,捕捉在梦世界中发现的精灵。,有点与众不同的球。 能很容易地捕捉 睡眠状态的精灵。
622,622,,邪教供应商垃圾。,以 30000 神奇币的价格出售给矿石收藏家。,以纯金制成， 闪着金光的大珠子。 可以在商店高价出售。
669,669,,持有：当持有者使用伤害性的一般属性技能时，该技能威力增加 1.5 倍，并消耗该物品。,持有：使用伤害性的一般属性技能时，技能威力增加 1.5 倍并消耗该物品。,一般属性的宝石。 携带后，一般属性的 技能威力只会增强１次。
682,682,,持有：当持有者受到效果绝佳的技能击中时，攻击力和特攻力提升两级。,持有：当持有者受到效果绝佳的技能击中时，攻击力和特攻力提升两级。,被针对弱点时， 攻击和特攻就会大幅提高。
683,683,,持有者特防提升至1.5倍。阻止持有者选择状态技能。,持有者特防提升至1.5倍。阻止持有者选择状态技能。,会变得富有攻击性的背心。 虽然携带后特防会提高， 但会无法使出变化技能。
684,684,,持有：持有者的妖精属性技能造成的伤害增加 20%。将阿尔宙斯和审判的属性更改为妖精。,持有：持有者的妖精属性技能造成的伤害增加 20%。将阿尔宙斯和审判的属性更改为妖精。,妖精属性的石板。 携带后，妖精属性的 技能威力就会增强。
686,686,,由绵绵泡芙持有：通信交换时将持有者进化为胖甜妮。,绵绵泡芙通信交换时持有：持有者进化为胖甜妮。,松松软软起着泡的， 稍微有点甜的奶油。 某种精灵很喜欢它。
687,687,,由粉香香持有：通信交换时将持有者进化为芳香精。,粉香香通信交换时持有：持有者进化为芳香精。,装着散发微浓香气的 香料的袋子。 某种精灵很喜欢它。
688,688,,持有：如果持有者受到伤害性的水属性技能击中，则会消耗该物品并提高一级特防。,持有：若持有者受到伤害性的水属性技能击中，其特防提升一级。,一次性使用的光苔。 携带它的精灵如果受到水属性 技能攻击，特防就会提高。
689,689,,持有：若持有者受到伤害性的冰属性技能击中，其攻击力提升一级。,持有：若持有者受到伤害性的冰属性技能击中，其攻击力提升一级。,一次性使用的雪球。 携带它的精灵如果受到冰属性 技能攻击，攻击就会提高。
690,690,,持有：防止粉末技能造成的伤害以及冰雹和沙尘暴造成的伤害。,持有：防止粉末技能造成的伤害以及冰雹和沙尘暴造成的伤害。,不单是天气造成的伤害， 就连粉末类技能的效果 也能防御的护目镜。
723,723,,持有：被效果绝佳的妖精属性攻击击中时消耗，使伤害减半。,持有：被效果绝佳的妖精属性攻击击中时消耗，使伤害减半。,让精灵携带后， 在受到效果绝佳的妖精属性技能 攻击时，能令其威力减弱。
724,724,3,持有：持有者受到物理攻击时，防御力提升一级。,持有：持有者受到物理攻击时，防御力提升一级。,让精灵携带后， 在受到物理技能攻击时， 自己的防御就会提高。
725,725,3,持有：当持有者受到特殊技能击中时，其特防增加一级。,持有：当持有者受到特殊技能击中时，其特防增加一级。,让精灵携带后， 在受到特殊技能攻击时， 自己的特防就会提高。
836,836,,与极限特训人员交换，将一只精灵的一项个体值视为最高。,与极限特训人员交换，使精灵的一项个体值视为最高。,银色的美丽王冠。 有些人收到它会很高兴。
837,837,,与极限特训人员交换，将精灵的所有个体值视为最高。,与极限特训人员交换，使精灵的所有个体值视为最高。,金色的美丽王冠。 比银色王冠珍贵。 有些人收到它会很高兴。
883,883,,使野生精灵更有可能召唤同伴。持有：受到威吓影响时，持有者的速度提升1级。,使野生精灵更有可能召唤同伴。持有：受到威吓影响时，持有者的速度提升1级。,让精灵携带后， 在受到威吓时速度会提高。
885,885,,用于队伍精灵：将阿罗拉山鼩进化为阿罗拉沙刃，或将阿罗拉六尾进化为阿罗拉九尾。,将阿罗拉沙鼩进化为阿罗拉沙斩，或将阿罗拉六尾进化为阿罗拉九尾。,能让某些特定精灵 进化的神奇石头。 有着雪花般的花纹。
887,887,,用于战斗：尝试捕捉野生精灵。如果野生精灵是究极异兽，则该球的捕获率为 5 倍。否则，捕获率为 0.1×。如果在训练师对战中使用，则不会产生效果并会消耗。,试图捕捉野生精灵。究极异兽的成功率为 5 倍，所有其他精灵的成功率为 0.1 倍。,有些与众不同的精灵球。 很难捕捉一般的精灵。
896,896,,持有：当持有者改变地形（无论是通过技能还是能力）时，它将持续 8 回合而不是 5 回合。,持有：将持有者的地形效果延长至8回合。,当携带它的精灵 利用技能或特性展开场地时， 场地的持续时间会比平时更长。
897,897,,持有：使用接触类技能攻击时，不会受到目标因接触产生的效果。,持有：防止接触攻击触发目标的接触效果。,不会受到触碰攻击对手时 本应受到的效果。
898,898,,持有：如果持有者在电域中进入对战，或者在对战中激活了电域，则该物品被消耗，持有者的防御力上升一级。,持有：在电地形上消耗，持有者防御力提升一级。,让精灵携带后， 在电气场地上使用， 防御就会提高。
899,899,,持有：若持有者在精神场地进入对战，或在对战中开启精神场地，则该物品会被消耗，持有者的特防提升一级。,持有：在精神场地消耗，持有者的特防提升一级。,让精灵携带后， 在精神场地上使用， 特防就会提高。
900,900,,持有：如果持有者在迷雾之地中进入对战，或者在对战中激活迷雾之地，则该物品会被消耗，持有者的特防会上升一级。,持有：在迷雾之地消耗，持有者特防提升一级。,让精灵携带后， 在薄雾场地上使用， 特防就会提高。
901,901,,持有：如果持有者在草地地形中进入对战，或者如果持有者在对战中激活草地地形，则该物品会被消耗，并且持有者的防御力会上升一级。,持有：在草地上消耗，持有者的防御力提升一级。,让精灵携带后， 在青草场地上使用， 防御就会提高。
1161,1161,,据说很久以前，英雄就是 拿着这把剑驱走了灾厄。 而现在早已变得锈迹斑斑。,据说很久以前，英雄就是 拿着这把剑驱走了灾厄。 而现在早已变得锈迹斑斑。,据说很久以前，英雄就是 拿着这把剑驱走了灾厄。 而现在早已变得锈迹斑斑。
1162,1162,,据说很久以前，英雄就是 拿着这面盾驱走了灾厄。 而现在早已变得锈迹斑斑。,据说很久以前，英雄就是 拿着这面盾驱走了灾厄。 而现在早已变得锈迹斑斑。,据说很久以前，英雄就是 拿着这面盾驱走了灾厄。 而现在早已变得锈迹斑斑。
1167,1167,,草莓形状的工艺糖果。 让小仙奶携带的话， 会高兴地转圈圈。,草莓形状的工艺糖果。 让小仙奶携带的话， 会高兴地转圈圈。,草莓形状的工艺糖果。 让小仙奶携带的话， 会高兴地转圈圈。
1168,1168,,爱心形状的工艺糖果。 让小仙奶携带的话， 会高兴地转圈圈。,爱心形状的工艺糖果。 让小仙奶携带的话， 会高兴地转圈圈。,爱心形状的工艺糖果。 让小仙奶携带的话， 会高兴地转圈圈。
1169,1169,,浆果形状的工艺糖果。 让小仙奶携带的话， 会高兴地转圈圈。,浆果形状的工艺糖果。 让小仙奶携带的话， 会高兴地转圈圈。,浆果形状的工艺糖果。 让小仙奶携带的话， 会高兴地转圈圈。
1170,1170,,四叶草形状的工艺糖果。 让小仙奶携带的话， 会高兴地转圈圈。,四叶草形状的工艺糖果。 让小仙奶携带的话， 会高兴地转圈圈。,四叶草形状的工艺糖果。 让小仙奶携带的话， 会高兴地转圈圈。
1171,1171,,花朵形状的工艺糖果。 让小仙奶携带的话， 会高兴地转圈圈。,花朵形状的工艺糖果。 让小仙奶携带的话， 会高兴地转圈圈。,花朵形状的工艺糖果。 让小仙奶携带的话， 会高兴地转圈圈。
1172,1172,,星星形状的工艺糖果。 让小仙奶携带的话， 会高兴地转圈圈。,星星形状的工艺糖果。 让小仙奶携带的话， 会高兴地转圈圈。,星星形状的工艺糖果。 让小仙奶携带的话， 会高兴地转圈圈。
1173,1173,,蝴蝶结形状的工艺糖果。 让小仙奶携带的话， 会高兴地转圈圈。,蝴蝶结形状的工艺糖果。 让小仙奶携带的话， 会高兴地转圈圈。,蝴蝶结形状的工艺糖果。 让小仙奶携带的话， 会高兴地转圈圈。
1174,1174,,这种神奇的苹果 可以使特定的精灵进化。 吃起来非常甜美。,这种神奇的苹果 可以使特定的精灵进化。 吃起来非常甜美。,这种神奇的苹果 可以使特定的精灵进化。 吃起来非常甜美。
1175,1175,,这种神奇的苹果 可以使特定的精灵进化。 吃起来酸酸的。,这种神奇的苹果 可以使特定的精灵进化。 吃起来酸酸的。,这种神奇的苹果 可以使特定的精灵进化。 吃起来酸酸的。
1176,1176,,使用声音相关的技能时， 特攻会提高。,使用声音相关的技能时， 特攻会提高。,使用声音相关的技能时， 特攻会提高。
1177,1177,,当携带它的精灵能力下降时， 同行精灵就会自动替换上场。,当携带它的精灵能力下降时， 同行精灵就会自动替换上场。,当携带它的精灵能力下降时， 同行精灵就会自动替换上场。
1178,1178,,不受脚下陷阱等的影响。,不受脚下陷阱等的影响。,不受脚下陷阱等的影响。
1179,1179,,技能因命中率影响而落空时， 速度会大幅提高。,技能因命中率影响而落空时， 速度会大幅提高。,技能因命中率影响而落空时， 速度会大幅提高。
1180,1180,,让精灵携带后， 在戏法空间使用时， 速度会下降。,让精灵携带后， 在戏法空间使用时， 速度会下降。,让精灵携带后， 在戏法空间使用时， 速度会下降。
1181,1181,,携带它的精灵 在下雨或日照很强时， 不会受到天气的影响。,携带它的精灵 在下雨或日照很强时， 不会受到天气的影响。,携带它的精灵 在下雨或日照很强时， 不会受到天气的影响。
1311,1311,,这个神奇的茶壶 可以使特定的精灵进化。 虽然有破损，但泡出来的茶依旧清香。,这个神奇的茶壶 可以使特定的精灵进化。 虽然有破损，但泡出来的茶依旧清香。,这个神奇的茶壶 可以使特定的精灵进化。 虽然有破损，但泡出来的茶依旧清香。
1312,1312,,这个神奇的茶壶 可以使特定的精灵进化。 虽然有缺陷，但泡出来的茶依旧清香。,这个神奇的茶壶 可以使特定的精灵进化。 虽然有缺陷，但泡出来的茶依旧清香。,这个神奇的茶壶 可以使特定的精灵进化。 虽然有缺陷，但泡出来的茶依旧清香。
1633,1633,,用伽勒豆蔻枝编织的手环。 给伽勒尔地区的呆呆兽戴上， 它就会很开心。,用伽勒豆蔻枝编织的手环。 给伽勒尔地区的呆呆兽戴上， 它就会很开心。,用伽勒豆蔻枝编织的手环。 给伽勒尔地区的呆呆兽戴上， 它就会很开心。
1643,1643,,用伽勒豆蔻枝编织的花环头饰。 给伽勒尔地区的呆呆兽戴上这种头饰， 它就会很开心。,用伽勒豆蔻枝编织的花环头饰。 给伽勒尔地区的呆呆兽戴上这种头饰， 它就会很开心。,用伽勒豆蔻枝编织的花环头饰。 给伽勒尔地区的呆呆兽戴上这种头饰， 它就会很开心。
1659,1659,,暂无说明。,暂无说明。,
1660,1660,,暂无说明。,暂无说明。,
1661,1661,,暂无说明。,暂无说明。,
1675,1675,,暂无说明。,暂无说明。,
1676,1676,,暂无说明。,暂无说明。,
1677,1677,,暂无说明。,暂无说明。,
1696,1696,,暂无说明。,暂无说明。,
1697,1697,,暂无说明。,暂无说明。,
1698,1698,,暂无说明。,暂无说明。,
1699,1699,,暂无说明。,暂无说明。,
1700,1700,,暂无说明。,暂无说明。,
1701,1701,,暂无说明。,暂无说明。,
1702,1702,,暂无说明。,暂无说明。,
2045,2045,,暂无说明。,暂无说明。,
2105,2105,,暂无说明。,暂无说明。,
2106,2106,,暂无说明。,暂无说明。,
2107,2107,,暂无说明。,暂无说明。,
2108,2108,,暂无说明。,暂无说明。,
2109,2109,,暂无说明。,暂无说明。,
2110,2110,,暂无说明。,暂无说明。,
2111,2111,,暂无说明。,暂无说明。,
2230,2230,,暂无说明。,暂无说明。,
2231,2231,,暂无说明。,暂无说明。,
2232,2232,,暂无说明。,暂无说明。,
