id,item_id,fling_effect_id,effect,short_effect,flavor_text
198,198,7,对战中持有：伤害性技能有 10% 几率使目标畏缩。连续招式的每次命中都会独立判定。这个几率与招式本身的追加效果分别判定；例如原本有 30% 畏缩几率的招式携带此物品后，总畏缩几率为 37%。蚊香君或呆呆兽携带后通信交换，会分别进化为蚊香蛙皇或呆呆王。,持有：伤害性技能有 10% 几率使目标畏缩。蚊香君或呆呆兽携带后通信交换会进化。,携带后进行攻击， 在造成伤害时， 有时会让对手畏缩。
199,199,,对战中持有：持有者的虫属性技能威力为1.2倍。,持有：持有者的虫属性技能造成的伤害提高 20%。,散发着银色光辉的粉末。 携带后，虫属性的 技能威力就会提高。
202,202,,拉帝亚斯或拉帝欧斯持有：持有者特攻、特防增加50%。,拉帝亚斯和拉帝欧斯的特攻、特防提升50%。,让拉帝欧斯或拉帝亚斯携带后， 超能力和龙属性的技能威力 就会提高的神奇珠子。
203,203,,珍珠贝持有：持有者的特攻加倍。通信交换时进化为猎斑鱼。,让珍珠贝的特攻加倍。通信交换时持有者进化为猎斑鱼。,让珍珠贝携带后， 特攻就会提高的牙齿。 散发着闪亮的银光。
204,204,,珍珠贝持有：持有者的特防加倍。通信交换时进化为樱花鱼。,让珍珠贝的特防加倍。通信交换时持有者进化为樱花鱼。,让珍珠贝携带后， 特防就会提高的鳞片。 散发着淡淡的粉红色光芒。
207,207,,持有：如果持有者受到通常伤害并濒死，该物品有 10% 的几率防止持有者的 ＨＰ 降至 1 以下。,持有：持有者有 10% 的几率在 1 ＨＰ 的攻击或自伤中幸存。,携带后，即便受到 可能会导致濒死的技能， 有时也能仅以１ＨＰ撑过去。
209,209,,持有：持有者的击中要害计数增加 1。,持有：持有者的击中要害率提升一级。,能看见弱点的镜片。 携带它的精灵的技能 会变得容易击中要害。
210,210,,持有：持有者的钢属性技能威力增加 20%。由大岩蛇或飞天螳螂持有并通信交换时，分别进化为大钢蛇或巨钳螳螂。,持有：持有者的钢属性技能造成的伤害提高 20%。,特殊的金属膜。 携带后，钢属性的 技能威力就会提高。
211,211,,持有：每回合结束时，治疗持有者最大生命值的 1/16。,持有：每回合结束时恢复持有者最大生命值的1/16（6.25%）。,携带后，精灵的ＨＰ 会在战斗期间缓缓回复。
212,212,,由海刺龙持有：通信交换时将持有者进化为刺龙王。,海刺龙通信交换时持有：持有者进化为刺龙王。,又硬又坚固的鳞片。 龙属性精灵有时会携带它。
213,213,5,皮卡丘持有：持有者的初始攻击力和特攻力加倍。,皮卡丘的攻击力和特攻力加倍。培育皮卡丘或雷丘：皮丘蛋将拥有伏特钓具。,让皮卡丘携带后， 攻击和特攻的威力 就会提高的神奇之球。
214,214,,持有：持有者的地面属性技能威力增加 20%。,持有：持有者的地面属性技能造成的伤害提高 20%。,手感细腻的沙子。 携带后，地面属性的 技能威力就会提高。
215,215,,持有：持有者的岩石属性技能威力增加 20%。,持有：持有者的岩石属性技能造成的伤害增加 20%。,绝对不会裂开的石头。 携带后，岩石属性的 技能威力就会提高。
216,216,,持有：持有者的草属性技能威力增加20%。,持有：持有者的草属性技能造成的伤害提高 20%。,孕育生命的种子。 携带后，草属性的 技能威力就会提高。
217,217,,持有：持有者的恶属性技能威力增加20%。,持有：持有者的恶属性技能造成的伤害提高 20%。,看上去很奇怪的眼镜。 携带后，恶属性的 技能威力就会提高。
218,218,,持有：持有者的格斗属性技能威力增加20%。,持有：持有者的格斗属性技能造成的伤害提高 20%。,能振作精神的带子。 携带后，格斗属性的 技能威力就会提高。
219,219,,持有：持有者的电属性技能威力增加 20%。,持有：持有者的电属性技能造成的伤害提高 20%。,强力的磁铁。 携带后，电属性的 技能威力就会提高。
220,220,,持有：持有者的水属性技能威力增加20%。,持有：持有者的水属性技能造成的伤害提高 20%。,水滴形状的宝石。 携带后，水属性的 技能威力就会提高。
221,221,,持有：持有者的飞行属性技能威力增加20%。,持有：持有者的飞行属性技能造成的伤害提高 20%。,又长又尖的鸟嘴。 携带后，飞行属性的 技能威力就会提高。
222,222,6,持有：持有者的毒属性技能威力增加 20%。,持有：持有者的毒属性技能造成的伤害提高 20%。,有毒的小针。 携带后，毒属性的 技能威力就会提高。
223,223,,持有：持有者的冰属性技能威力增加20%。,持有：持有者的冰属性技能造成的伤害提高 20%。,能隔绝热量的冰。 携带后，冰属性的 技能威力就会提高。
224,224,,持有：持有者的幽灵属性技能威力增加20%。,持有：持有者的幽灵属性技能造成的伤害提高 20%。,古怪可怕的咒符。 携带后，幽灵属性的 技能威力就会提高。
225,225,,持有：持有者的超能力属性技能威力增加20%。,持有：持有者的超能力属性技能造成的伤害提高 20%。,注入了念力的汤匙。 携带后，超能力属性的 技能威力就会提高。
226,226,,持有：持有者的火属性技能威力增加20%。,持有：持有者的火属性技能造成的伤害提高 20%。,焚烧用的燃料。 携带后，火属性的 技能威力就会提高。
227,227,,持有：持有者的龙属性技能威力增加20%。,持有：持有者的龙属性技能造成的伤害增加 20%。,坚硬锐利的牙齿。 携带后，龙属性的 技能威力就会提高。
228,228,,持有：持有者的一般属性技能威力增加20%。,持有：持有者的一般属性技能造成的伤害增加 20%。,手感不错的围巾。 携带后，一般属性的 技能威力就会提高。
229,229,,由多边兽持有：通信交换时将持有者进化为多边兽２型。,多边兽通信交换时持有：持有者进化为多边兽２型。,内部储存了各种信息的透明机器。 西尔佛公司制造。
230,230,,持有：治疗持有者所造成伤害的 1/8。,持有：持有者受到攻击时所造成伤害的 1/8。,当携带它的精灵 攻击对手并造成伤害时， 能回复少量ＨＰ。
242,242,,持有：持有者使用的任何技能的命中率提高 10%（相乘；即 70% 的命中率增加到 77%）。,持有：为持有者提供 1/10 (10%) 的命中率提升。,能放大观看物体的镜片。 携带后，技能的命中率 就会少量提高。
243,243,,持有：持有者的物理技能威力增加10%。,持有：持有者使用的物理技能的伤害提高10%。,力如泉涌的头带。 携带后，物理技能的 威力就会少量提高。
244,244,,持有：持有者的特殊技能威力增加10%。,持有：使持有者使用的特殊技能伤害提高 10%。,装着很厚镜片的眼镜。 携带后，特殊技能的 威力就会少量提高。
245,245,,持有：持有者使出效果绝佳的技能时，威力提升20%。,持有：持有者的效果绝佳技能会造成 20% 的额外伤害。,用惯了的黑色带子。 携带后，效果绝佳时的 技能威力就会少量提高。
246,246,,持有：持有者的反射壁和光墙将产生持续八回合而不是五回合的效果。由于该物品影响技能而不是屏障本身，因此如果持有者离开对战或掉落该物品，效果不会丢失。,持有：持有者使用的光墙和反射壁持续 8 轮，而不是 5 轮。,当携带它的精灵 使出光墙或反射壁时， 效果会比平时持续得更长。
247,247,,持有：持有者的技能造成的伤害增加 30%。持有者每回合使用造成伤害的技能时，都会受到最大生命值 10% 的伤害。,持有：持有者的技能会造成 30% 的额外伤害，但会消耗 10% 的最大生命值。,携带后，虽然每次攻击时 ＨＰ少量减少， 但技能的威力会提高。
248,248,,持有：使用弹跳、挖洞、潜水、飞翔、旋风刀、火箭头锤、神鸟猛击或日光束等需要蓄力的招式时，会消耗该道具并跳过蓄力回合。火箭头锤仍会提升防御。,持有：两回合蓄力招式会跳过蓄力回合。使用后消耗。,携带它的精灵仅有１次机会 可以在第１回合使出 需要蓄力的技能。
249,249,1,持有：每回合结束时使持有者剧毒。,持有：在回合结束时对持有者造成有毒。发生中毒伤害后激活。,触碰后会放出毒的神奇宝珠。 携带后，在战斗时会变成剧毒状态。
250,250,2,持有：每回合结束时灼伤持有者。,持有：回合结束时灼伤持有者。灼伤伤害结算后激活。,触碰后会放出热量的神奇宝珠。 携带后，在战斗时会变成灼伤状态。
252,252,,持有：ＨＰ全满时受到会导致濒死的直接伤害，会消耗该道具并至少保留 1 点ＨＰ。该效果可作用于连续招式，但不作用于破灭之愿或预知未来。,持有：ＨＰ全满时可承受一次致命伤害并保留 1 点ＨＰ。,携带后，在ＨＰ全满时， 即便受到可能会导致濒死的技能， 也能仅以１ＨＰ撑过去１次。
253,253,,持有：最后持有者的命中率提高 20%。游戏内描述不正确。,持有：如果持有者在目标之后行动，则命中率提高 1/5 (20%)。,当携带它的精灵比 对手行动迟缓时， 技能会变得容易命中。
254,254,,持有：持有者每次连续使用同一技能，威力会再增加原来的10%，最高可达100%。,持有：连续使用同一攻击可累积伤害提升 10%。最大提升 100%。,携带后，连续使出相同技能时， 威力就会提高。不再使出 相同技能时，威力就会复原。
255,255,,持有：持有者的速度降低 50%。如果持有者处于飞行状态或具有悬浮状态，它会受到地面属性攻击的通常伤害，并且可能受到撒菱和毒菱的影响。,持有：速度减半，并取消飞行或飘浮带来的地面免疫；撒菱和毒菱也会影响持有者。,携带后，速度会降低。 飞行属性以及飘浮精灵 会被地面属性技能击中。
256,256,,持有：持有者将在其技能的优先级范围内最后进行，无论速度如何。如果同一优先级内的多个精灵受到此效果，则速度较慢的精灵将首先出现。持有者会在具有慢出特性的精灵之后行动。如果持有者具有慢出特性，则该特性被忽略。该物品不受戏法空间影响。,持有：持有者在其优先级括号中最后行动。,非常沉重的某种尾巴。 携带后，行动会比平时更加迟缓。
257,257,,持有：当持有者被吸引时，它被吸引的精灵会被吸引回来。,持有：持有者陷入迷恋状态时，对方的精灵会陷入迷恋状态。,长长的鲜红色细线。 携带后，在自己着迷时 能让对手也着迷。
258,258,,持有：如果持有者是毒属性，每回合结束时恢复最大生命值1/16。否则，每回合结束时对持有者造成最大生命值1/16的伤害。,持有：毒系持有者每回合恢复最大生命值1/16（6.25%）。非毒属性受到 1/8 (12.5%) 最大生命值伤害。,携带后，毒属性的精灵 会缓缓回复ＨＰ。 其他属性的话，ＨＰ则会减少。
259,259,,持有：持有者使出的冰雹持续八回合而不是五回合。该物品影响技能产生的天气，因此持有者离场或失去道具后，已经产生的天气持续时间不会改变。,持有：持有者使出的冰雹持续 8 回合，而不是 5 回合。,携带它的精灵使出冰雹的话， 冰雹的时间就会比平时更长。
260,260,,持有：持有者使出的沙暴持续八回合而不是五回合。该物品影响技能产生的天气，因此持有者离场或失去道具后，已经产生的天气持续时间不会改变。,持有：持有者使出的沙暴持续 8 回合，而不是 5 回合。,携带它的精灵使出沙暴的话， 沙暴的时间就会比平时更长。
261,261,,持有者使出大晴天时，晴天持续 8 回合而不是 5 回合。该物品影响招式产生的天气，因此持有者离场或失去道具后，已经产生的天气持续时间不会改变。,持有者使出的大晴天持续 8 回合。,携带它的精灵使出大晴天的话， 晴天的时间就会比平时更长。
262,262,,持有者使出求雨时，雨天持续 8 回合而不是 5 回合。该物品影响招式产生的天气，因此持有者离场或失去道具后，已经产生的天气持续时间不会改变。,持有者使出的求雨持续 8 回合。,携带它的精灵使出求雨的话， 下雨的时间就会比平时更长。
263,263,,持有：将持有者的多回合（2-5回合）技能的持续时间增加三回合。,持有：持有者的多回合诱捕技能持续 5 回合。,携带后，绑紧以及紧束等 会持续造成伤害的技能的 回合数会增加。
264,264,,持有：使持有者的速度提高 50%，但仅限于其使用的第一个技能，直到其离开对战或失去该物品。如果该道具通过戏法或掉包交换为另一个讲究类道具，则持有者的限制仍然会解除，但它将再次受到其使用的下一个技能限制。（特殊情况：如果持有者通过急速折返替换上场，并且它也会急速折返，则急速折返会成为其限制技能。）,持有：速度提高 50%，但限制持有者只能使出一招。,有点讲究的围巾。 虽然携带后速度会提高， 但只能使出相同的技能。
265,265,,持有：每回合结束时，持有者损失最大生命值的 1/8。持有者受到接触技能攻击时，对攻击者造成最大生命值1/8的伤害；如果攻击者没有持有物品，则会拿走该物品。,持有：持有者每回合结束时损失最大生命值的 1/8。受到接触技能攻击时，攻击者受到最大生命值 1/8 的伤害；若攻击者没有持有道具，则会获得该物品。,携带后，每回合都会受到伤害。 有时也会附着到 碰到自己的对手身上。
266,266,,持有：持有者的速度降低 50%。每当持有者从对战中获得攻击努力值时，攻击努力值增加 4 点；此加成在病毒倍增效果之前结算。,持有：持有者获得 4 点攻击努力值，但在对战中速度减半。,虽然携带后速度会降低， 但精灵的攻击 会比平时成长得更高。
267,267,,持有：持有者的速度降低 50%。每当持有者从对战中获得防御努力值时，防御努力值增加 4 点；此加成在病毒倍增效果之前结算。,持有：持有者获得 4 点防御努力值，但在对战中速度减半。,虽然携带后速度会降低， 但精灵的防御 会比平时成长得更高。
268,268,,持有：持有者的速度降低 50%。每当持有者从对战中获得特攻努力值时，特攻努力值增加 4 点；此加成在病毒倍增效果之前结算。,持有：持有者获得 4 点特攻努力值，但在对战中速度减半。,虽然携带后速度会降低， 但精灵的特攻 会比平时成长得更高。
269,269,,持有：持有者的速度降低 50%。每当持有者从对战中获得特防努力值时，特防努力值增加 4 点；此加成在病毒倍增效果之前结算。,持有：持有者获得 4 点特防努力值，但在对战中速度减半。,虽然携带后速度会降低， 但精灵的特防 会比平时成长得更高。
270,270,,持有：持有者的速度降低 50%。每当持有者从对战中获得速度努力值时，速度努力值增加 4 点；此加成在病毒倍增效果之前结算。,持有：持有者获得 4 点速度努力值，但在对战中速度减半。,虽然携带后速度会降低， 但精灵的速度 会比平时成长得更高。
271,271,,持有：持有者的速度降低 50%。每当持有者从对战中获得ＨＰ努力值时，ＨＰ努力值增加 4 点；此加成在病毒倍增效果之前结算。,持有：持有者获得 4 点ＨＰ努力值，但在对战中速度减半。,虽然携带后速度会降低， 但精灵的ＨＰ 会比平时成长得更高。
272,272,,持有：持有者不受任何阻止其主动离开对战的技能或能力的影响。,持有：持有者可以绕过所有陷印效果并切换出去。多回合技能仍然无法切换出去。,结实坚硬的空壳。 携带它的精灵必定可以 和后备的精灵进行替换。
273,273,,持有：吸收、水之环、汲取拳、食梦者、千兆汲取、根粒、水蛭生命、水蛭种子和超级汲取恢复的生命值增加 30%。造成的伤害不受影响。,持有：汲取技能、铭晶、水之戒恢复的生命值增加 3/10（30%）。,携带后，吸取ＨＰ的技能 可以比平时更多地回复自己的ＨＰ。
274,274,,持有：持有者的特殊攻击力提高 50%，但仅限于其使用的第一个技能，直到其离开对战或失去该物品为止。如果该道具通过戏法或掉包交换为另一个讲究类道具，则持有者的限制仍然会解除，但它将再次受到其使用的下一个技能限制。（特殊情况：如果持有者通过急速折返替换上场，并且它也会急速折返，则急速折返会成为其限制技能。）,持有：特攻增加 50%，但限制持有者只能进行一招。,有点讲究的眼镜。 虽然携带后特攻会提高， 但只能使出相同的技能。
275,275,,持有：持有者的火属性技能威力增加20%。由拥有多属性的精灵持有：持有者的属性变为火。,持有：持有者的火属性技能造成的伤害提高 20%。将阿尔宙斯和审判的属性更改为火。,火属性的石板。 携带后，火属性的 技能威力就会增强。
276,276,,持有：持有者的水属性技能威力增加20%。由拥有多属性的精灵持有：持有者的属性变为水。,持有：持有者的水属性技能造成的伤害提高 20%。将阿尔宙斯和审判的属性更改为水。,水属性的石板。 携带后，水属性的 技能威力就会增强。
277,277,,持有：持有者的电属性技能威力增加 20%。由拥有多属性的精灵持有：持有者的属性变为电属性。,持有：持有者的电属性技能造成的伤害提高 20%。将阿尔宙斯和审判的属性更改为电属性。,电属性的石板。 携带后，电属性的 技能威力就会增强。
278,278,,持有：持有者的草属性技能威力增加20%。由拥有多属性的精灵持有：持有者的属性变为草属性。,持有：持有者的草属性技能造成的伤害提高 20%。将阿尔宙斯和审判的属性更改为草属性。,草属性的石板。 携带后，草属性的 技能威力就会增强。
279,279,,持有：持有者的冰属性技能威力增加20%。由拥有多属性的精灵持有：持有者的属性变为冰属性。,持有：持有者的冰属性技能造成的伤害提高 20%。将阿尔宙斯和审判的属性更改为冰属性。,冰属性的石板。 携带后，冰属性的 技能威力就会增强。
280,280,,持有：持有者的格斗属性技能威力增加20%。由拥有多属性的精灵持有：持有者的属性变为格斗。,持有：持有者的格斗属性技能造成的伤害提高 20%。将阿尔宙斯和审判的属性更改为格斗属性。,格斗属性的石板。 携带后，格斗属性的 技能威力就会增强。
281,281,,持有：持有者的毒属性技能威力增加 20%。由拥有多属性的精灵持有：持有者的属性变为毒属性。,持有：持有者的毒属性技能造成的伤害提高 20%。将阿尔宙斯和审判的属性更改为毒属性。,毒属性的石板。 携带后，毒属性的 技能威力就会增强。
282,282,,持有：持有者的地面属性技能威力增加 20%。由拥有多属性的精灵持有：持有者的属性变为地面属性。,持有：持有者的地面属性技能造成的伤害提高 20%。将阿尔宙斯和审判的属性更改为地面属性。,地面属性的石板。 携带后，地面属性的 技能威力就会增强。
283,283,,持有：持有者的飞行属性技能威力增加20%。由拥有多属性的精灵持有：持有者的属性变为飞行属性。,持有：持有者的飞行属性技能造成的伤害提高 20%。将阿尔宙斯和审判的属性更改为飞行属性。,飞行属性的石板。 携带后，飞行属性的 技能威力就会增强。
284,284,,持有：持有者的超能力属性技能威力增加20%。由拥有多属性的精灵持有：持有者的属性变为超能力属性。,持有：持有者的超能力属性技能造成的伤害提高 20%。将阿尔宙斯和审判的属性更改为超能力属性。,超能力属性的石板。 携带后，超能力属性的 技能威力就会增强。
285,285,,持有：持有者的虫属性技能威力增加20%。由拥有多属性的精灵持有：持有者的属性变为虫。,持有：持有者的虫属性技能造成的伤害提高 20%。将阿尔宙斯和审判的属性更改为虫。,虫属性的石板。 携带后，虫属性的 技能威力就会增强。
286,286,,持有：持有者的岩石属性技能威力增加 20%。由拥有多属性的精灵持有：持有者的属性变为岩石属性。,持有：持有者的岩石属性技能造成的伤害增加 20%。将阿尔宙斯和审判的属性更改为岩石属性。,岩石属性的石板。 携带后，岩石属性的 技能威力就会增强。
287,287,,持有：持有者的幽灵属性技能威力增加20%。由拥有多属性的精灵持有：持有者的属性变为幽灵属性。,持有：持有者的幽灵属性技能造成的伤害提高 20%。将阿尔宙斯和审判的属性更改为幽灵属性。,幽灵属性的石板。 携带后，幽灵属性的 技能威力就会增强。
288,288,,持有：持有者的龙属性技能威力增加20%。由拥有多属性的精灵持有：持有者的属性变为龙属性。,持有：持有者的龙属性技能造成的伤害增加 20%。将阿尔宙斯和审判的属性更改为龙属性。,龙属性的石板。 携带后，龙属性的 技能威力就会增强。
289,289,,持有：持有者的恶属性技能威力增加20%。由拥有多属性的精灵持有：持有者的属性变为恶属性。,持有：持有者的恶属性技能造成的伤害提高 20%。将阿尔宙斯和审判的属性更改为恶属性。,恶属性的石板。 携带后，恶属性的 技能威力就会增强。
290,290,,持有：持有者的钢属性技能威力增加 20%。由拥有多属性的精灵持有：持有者的属性变为钢属性。,持有：持有者的钢属性技能造成的伤害提高 20%。将阿尔宙斯和审判的属性更改为钢属性。,钢属性的石板。 携带后，钢属性的 技能威力就会增强。
298,298,,由钻角犀兽持有：通信交换时将持有者进化为超甲狂犀。,钻角犀兽通信交换时持有：持有者进化为超甲狂犀。,某种护具。 非常坚硬而且沉重。 某种精灵很喜欢它。
299,299,,由电击兽持有：通信交换时将持有者进化为电击魔兽。,电击兽通信交换时持有：持有者进化为电击魔兽。,积蓄着庞大电气能量的箱子。 某种精灵很喜欢它。
300,300,,由鸭嘴火兽持有：通信交换时将持有者进化为鸭嘴炎兽。,鸭嘴火兽通信交换时持有：持有者进化为鸭嘴炎兽。,积蓄着庞大熔岩能量的箱子。 某种精灵很喜欢它。
301,301,,由多边兽２型持有：通信交换时将持有者进化为多边兽乙型。,多边兽２型通信交换时持有：持有者进化为多边兽乙型。,内部储存了奇怪信息的透明机器。 制造者不明。
302,302,,由彷徨夜灵持有：通信交换时将持有者进化为黑夜魔灵。,彷徨夜灵通信交换时持有：持有者进化为黑夜魔灵。,蕴含着惊人强大灵力的布。 某种精灵很喜欢它。
303,303,,持有：将持有者的击中要害率提高一级。由狃拉持有时，在夜间升级会进化为玛狃拉。,持有：持有者的击中要害率提升一级。狃拉夜间升级时持有：持有者进化为玛狃拉。,尖锐的爪子。 携带后，技能会 变得容易击中要害。
304,304,7,持有：当持有者使用伤害性技能攻击时，有 10% 几率使目标畏缩。由天蝎持有时，在夜间升级会进化为天蝎王。,持有：伤害性技能有 10% 的几率使目标畏缩。天蝎夜间升级时持有：持有者进化为天蝎王。,尖锐的牙齿。 携带后，在给予伤害时， 有时会让对手畏缩。
442,442,,骑拉帝纳持有：持有者的龙属性和幽灵属性技能拥有基础威力的 1.2 倍。持有者处于起源形态。除了骑拉帝纳以外，其他精灵都无法持有该物品。当您进入联合室或连接到无线通信时，该物品会返回您的包中。,骑拉帝纳龙属性、幽灵属性技能的伤害提升20%，并转化为起源形态。,让骑拉帝纳携带的话， 龙和幽灵属性的技能威力就会提高。 散发着光辉的宝珠。
449,449,,训练师在战斗中使用：尝试捕捉野生精灵。如果在训练师对战中使用，则不会产生效果并会消耗。钓鱼遇到的野生精灵捕获率变为 3 倍。,钓鱼时捕获率提高 3 倍。由蓝色球果制成。,有点与众不同的球。 能很容易地捕捉 用钓竿钓上来的精灵。
